{
  "schema_version": 1,
  "generated_on": "2026-09-15",
  "purpose": "One row per load-bearing factual claim about an external system. A claim that cannot name its source and the words that source used does not belong in the pack. Rows with status verified-absent record a documented silence, which is itself a finding worth citing.",
  "statuses": {
    "verified": "The source states this and we read it on verified_on.",
    "verified-absent": "We checked and the source does not state this. The absence is the claim.",
    "expired": "Past its reverify interval. Treat every dependent statement as unsupported until rechecked."
  },
  "totals": {
    "claims": 26,
    "by_method": {
      "web-fetch": 16,
      "repo-file-read": 5,
      "local-probe": 2,
      "workspace-probe": 3
    },
    "by_status": {
      "verified": 24,
      "verified-absent": 2
    }
  },
  "claims": [
    {
      "id": "gw-usage-table",
      "claim": "Unity AI Gateway usage is recorded in the system table system.ai_gateway.usage.",
      "source": "https://docs.databricks.com/aws/en/ai-gateway/usage-tracking",
      "evidence": "The sole system table named on the page is `system.ai_gateway.usage`.",
      "verification_method": "web-fetch",
      "verified_on": "2026-09-15",
      "verified_by": "building-agent",
      "reverify_interval_days": 90,
      "status": "verified",
      "used_in": [
        "03-gateway-auth-and-governance",
        "11-admin-runbook",
        "12-operating-model-and-metrics"
      ]
    },
    {
      "id": "gw-usage-columns",
      "claim": "system.ai_gateway.usage exposes per-request identity, routing, token and status columns, which is what makes per-team attribution possible without instrumenting the harness.",
      "source": "https://docs.databricks.com/aws/en/ai-gateway/usage-tracking",
      "evidence": "Columns listed include account_id, workspace_id, request_id, invocation_id, endpoint_name, endpoint_tags, event_time, latency_ms, time_to_first_byte_ms, destination_type, destination_name, destination_model, requester, requester_type, ip_address, url, user_agent, api_type, request_tags, input_tokens, output_tokens, total_tokens, token_details, status_code, routing_information.",
      "verification_method": "web-fetch",
      "verified_on": "2026-09-15",
      "verified_by": "building-agent",
      "reverify_interval_days": 90,
      "status": "verified",
      "used_in": [
        "03-gateway-auth-and-governance",
        "11-admin-runbook",
        "12-operating-model-and-metrics"
      ]
    },
    {
      "id": "gw-request-tags-header",
      "claim": "Attribution tags are supplied on the request with the header Databricks-Ai-Gateway-Request-Tags, whose value is a JSON object mapping string keys to string values, and they surface in the request_tags column.",
      "source": "https://docs.databricks.com/aws/en/ai-gateway/usage-tracking",
      "evidence": "The header name given is `Databricks-Ai-Gateway-Request-Tags` and its value is described as \"a JSON object mapping string keys to string values\".",
      "verification_method": "web-fetch",
      "verified_on": "2026-09-15",
      "verified_by": "building-agent",
      "reverify_interval_days": 90,
      "status": "verified",
      "used_in": [
        "03-gateway-auth-and-governance",
        "10-offplatform-standard",
        "12-operating-model-and-metrics"
      ]
    },
    {
      "id": "gw-usage-freshness-unstated",
      "claim": "The usage table's data freshness is not stated in the documentation. Any latency figure in this pack is measured by us, not sourced.",
      "source": "https://docs.databricks.com/aws/en/ai-gateway/usage-tracking",
      "evidence": "No latency or freshness guarantee appears on the page. A separate note gives a dashboard refresh schedule of every 6 hours at version 0.3 or higher, which is a dashboard property, not data freshness.",
      "verification_method": "web-fetch",
      "verified_on": "2026-09-15",
      "verified_by": "building-agent",
      "reverify_interval_days": 90,
      "status": "verified-absent",
      "used_in": [
        "03-gateway-auth-and-governance",
        "11-admin-runbook"
      ],
      "note": "Load-bearing for lab-07: a learner who queries the table immediately after a session and sees nothing must be told this is expected, not a broken setup."
    },
    {
      "id": "gw-ratelimit-types",
      "claim": "Model services support requests-per-minute (QPM) and tokens-per-minute (TPM) limits; MCP services support QPM only.",
      "source": "https://docs.databricks.com/aws/en/ai-gateway/rate-limits",
      "evidence": "\"requests-per-minute (QPM) and tokens-per-minute (TPM) limits\" for model services; for MCP services, \"Token-based limits don't apply to MCP services\".",
      "verification_method": "web-fetch",
      "verified_on": "2026-09-15",
      "verified_by": "building-agent",
      "reverify_interval_days": 90,
      "status": "verified",
      "used_in": [
        "03-gateway-auth-and-governance",
        "04-skills-and-mcp",
        "11-admin-runbook"
      ]
    },
    {
      "id": "gw-ratelimit-precedence",
      "claim": "A user-specific limit overrides a group limit; a user in several groups is limited only when they exceed all of their groups' limits of that type; and where both a request and a token limit apply, the more restrictive is enforced.",
      "source": "https://docs.databricks.com/aws/en/ai-gateway/rate-limits",
      "evidence": "\"If a user belongs to both a user-specific limit and a group-specific limit, the user-specific limit is enforced\"; \"the user is rate limited if they exceed all of the QPM rate limits or all of the TPM rate limits of their user groups\"; \"the more restrictive rate limit is enforced\".",
      "verification_method": "web-fetch",
      "verified_on": "2026-09-15",
      "verified_by": "building-agent",
      "reverify_interval_days": 90,
      "status": "verified",
      "used_in": [
        "03-gateway-auth-and-governance",
        "11-admin-runbook"
      ],
      "note": "The multi-group rule is the counter-intuitive one and the most common admin mistake: adding a user to a second, more generous group loosens their effective limit rather than tightening it."
    },
    {
      "id": "gw-ratelimit-service-global",
      "claim": "The service-level rate limit is a global maximum for the service.",
      "source": "https://docs.databricks.com/aws/en/ai-gateway/rate-limits",
      "evidence": "\"The service rate limit is a global maximum\".",
      "verification_method": "web-fetch",
      "verified_on": "2026-09-15",
      "verified_by": "building-agent",
      "reverify_interval_days": 90,
      "status": "verified",
      "used_in": [
        "03-gateway-auth-and-governance",
        "11-admin-runbook"
      ]
    },
    {
      "id": "gw-ratelimit-429",
      "claim": "Exceeding a gateway rate limit returns HTTP 429, so clients need backoff rather than retry-immediately.",
      "source": "https://docs.databricks.com/aws/en/ai-gateway/rate-limits",
      "evidence": "\"HTTP 429 (Too Many Requests) response\".",
      "verification_method": "web-fetch",
      "verified_on": "2026-09-15",
      "verified_by": "building-agent",
      "reverify_interval_days": 90,
      "status": "verified",
      "used_in": [
        "03-gateway-auth-and-governance",
        "10-offplatform-standard",
        "06-testing-standard"
      ]
    },
    {
      "id": "gw-ratelimit-counts",
      "claim": "A service supports at most 20 rate limits, of which at most 5 may be group-specific.",
      "source": "https://docs.databricks.com/aws/en/ai-gateway/rate-limits",
      "evidence": "\"maximum of 20 rate limits per service\"; \"maximum of 5 group-specific rate limits per service\".",
      "verification_method": "web-fetch",
      "verified_on": "2026-09-15",
      "verified_by": "building-agent",
      "reverify_interval_days": 90,
      "status": "verified",
      "used_in": [
        "11-admin-runbook"
      ],
      "note": "This caps the design: per-team group limits do not scale past five teams on one service, so plan service-per-tier rather than group-per-team."
    },
    {
      "id": "gw-budget-actions",
      "claim": "A gateway budget threshold can either alert (email, access retained) or block (further requests prevented).",
      "source": "https://docs.databricks.com/aws/en/ai-gateway/budgets",
      "evidence": "Alert \"Sends an email notification to configured addresses. Users retain access to Unity Gateway.\" Block \"Prevents the user from making further requests through Unity Gateway.\"",
      "verification_method": "web-fetch",
      "verified_on": "2026-09-15",
      "verified_by": "building-agent",
      "reverify_interval_days": 90,
      "status": "verified",
      "used_in": [
        "03-gateway-auth-and-governance",
        "11-admin-runbook",
        "12-operating-model-and-metrics"
      ]
    },
    {
      "id": "gw-budget-not-a-cap",
      "claim": "A budget is near-real-time protection, not an invoice cap. Enforcement is approximate, in-flight requests are not interrupted, and Databricks states it is not responsible for spend above the threshold.",
      "source": "https://docs.databricks.com/aws/en/ai-gateway/budgets",
      "evidence": "\"Block usage thresholds are enforced approximately. Enforcement uses a near-real-time estimate of cost, so actual spend may vary above or below the configured threshold.\" \"Active requests in progress when the threshold is reached are not interrupted.\" \"Do not use this feature as a way to ensure an absolute spend cap on final billed amounts. Databricks is not responsible for costs incurred in excess of configured budget thresholds.\"",
      "verification_method": "web-fetch",
      "verified_on": "2026-09-15",
      "verified_by": "building-agent",
      "reverify_interval_days": 90,
      "status": "verified",
      "used_in": [